{
  "schema_version": "1.0.0",
  "run_id": "run-example-001",
  "account_ref": "douyin:local:account-a",
  "interest_profile": {
    "profile_id": "profile-photography-a",
    "account_ref": "douyin:local:account-a",
    "revision": 1,
    "name": "摄影器材与影像创作",
    "positive_topics": ["相机", "镜头", "摄影", "影像创作"],
    "high_priority_topics": ["相机评测", "镜头实拍"],
    "negative_topics": ["婚庆接单"],
    "boundary_guidance": ["只出现拍摄画面但没有器材或创作信息时，不直接判为相关。"],
    "classification": {"high_match_count": 2},
    "profile_hash": "sha256:b26f508d97cc25f2b3e1b5686a6703594bc839e33d5eb0ff437978b25200a233"
  },
  "goal": {
    "observed_target": 50,
    "relevant_target": null
  },
  "interaction_policy": {
    "rules": [
      {
        "eligible_relevance": ["high"],
        "like_rate": 0.3,
        "favorite_rate": 0.2,
        "like_favorite_overlap_rate": 0.1,
        "comment_rate": 0,
        "completion_rate": 0.15,
        "block_size": 20
      },
      {
        "eligible_relevance": ["medium"],
        "like_rate": 0.1,
        "favorite_rate": 0,
        "like_favorite_overlap_rate": 0,
        "comment_rate": 0,
        "completion_rate": 0,
        "block_size": 20
      }
    ],
    "comment": {"max_total": 0, "approval_mode": "per_run", "guidance": ""},
    "follow": {"eligible_relevance": ["high"], "rate": 0, "max_total": 0, "minimum_repeat_creator_count": 2, "block_size": 20},
    "not_interested": {"rate": 0, "max_total": 0, "block_size": 20},
    "profile_sampling": {"rate": 0, "max_total": 0}
  },
  "authorization": {
    "like": true,
    "favorite": true,
    "comment": false,
    "follow": false,
    "not_interested": false,
    "profile_visit": false
  },
  "versions": {
    "adapter": "douyin.v1",
    "classifier": "profile-keyword.v1",
    "policy": "quota.v2",
    "contract": "1.0.0"
  },
  "status": "waiting_for_confirmation"
}
